{
  "agent_id": "3c886647-2f6a-4ee9-8850-c5a5efbb22b1",
  "branch_id": "branch-e7890aee",
  "created_at": "2026-09-10T05:22:15.182187700+00:00",
  "genome": {
    "apiVersion": "v0alpha1",
    "bud_scars": 0,
    "capabilities": [
      "inspect",
      "reason",
      "mutate"
    ],
    "cell_id": "3c886647-2f6a-4ee9-8850-c5a5efbb22b1",
    "cognition": {
      "conscience": {
        "baseline_budget": 100.0,
        "current_budget": 100.0,
        "dissonance_level": 0.0,
        "eureka_moments": 0,
        "is_apoptotic": false,
        "max_dissonance_threshold": 50.0,
        "revision": 0
      },
      "organelles": []
    },
    "conscience": {
      "baseline_budget": 100.0,
      "current_budget": 100.0,
      "dissonance_level": 0.0,
      "eureka_moments": 0,
      "is_apoptotic": false,
      "max_dissonance_threshold": 50.0,
      "revision": 0
    },
    "hayflick_limit": 50,
    "identity": {
      "cell_id": "3c886647-2f6a-4ee9-8850-c5a5efbb22b1",
      "name": "gRPC worker",
      "name_meaning": "Agent autonome résilient de l'écosystème GenOS",
      "role": "worker"
    },
    "kind": "AgentGenome",
    "memory": {
      "consolidation": true,
      "ltd_decay": true,
      "synaptic_pruning": true,
      "type": "cognitive"
    },
    "memory_policy": {
      "consolidation": true,
      "ltd_decay": true,
      "synaptic_pruning": true
    },
    "metadata": {
      "name": "gRPC worker",
      "version": "0.1.0"
    },
    "model_policy": {
      "preferred": "default"
    },
    "models": {
      "preferred": "default"
    },
    "name": "gRPC worker",
    "name_meaning": "Agent autonome résilient de l'écosystème GenOS",
    "objectives": {
      "operational_mode": "autonomous",
      "primary": "worker"
    },
    "organelles": [],
    "policies": {
      "ephemeral_ttl": null,
      "hayflick_limit": 50,
      "is_ephemeral": false,
      "is_senescent": false
    },
    "role": "worker",
    "tool_policy": {
      "allowed_tools": [
        "genos_inspect",
        "genos_test"
      ]
    },
    "tools": {
      "allowed_tools": [
        "genos_inspect",
        "genos_test"
      ]
    }
  },
  "snapshot_id": "snap-e7890aee698842d9bb233f77b8dccf77",
  "state": {
    "dissonance": 0.0,
    "entropy": 0.42,
    "execution_status": "quiescent",
    "genesis_hash": "78233ad9d1dce9a6afffd7c7b119859e32667024aa622a001b5e6e050030c142",
    "working_memory": []
  },
  "world_id": "world-matrix-0"
}